STH,St Thomas Hospital,Guy's and St Thomas' NHS Foundation Trust,England,425,45,15,4,0,35,105,Yes,6,Yes,20,6,13,40,8,18,53,18,40,120,12,27,80,5,11,33,0,0,0,2,4,13,2,4,13,0,0,0,6,13,40,1,2,7,3,7,20,0,0,3,0,0,0,0,0,0,0,0,0
STM,"St Marys Hospital, Paddington",Imperial College Healthcare NHS Trust,England,235,45,15,10,2,64,24,Yes,2,Yes,15,3,7,20,11,24,73,17,38,113,10,22,67,0,0,1,0,0,0,0,0,0,0,0,0,9,20,60,0,0,0,0,0,0,5,11,33,0,0,4,0,0,0,0,0,0,0,0,0
STR,St Richards Hospital,Western Sussex Hospitals NHS Foundation Trust,England,195,1-7,1-7,10,0,21,20,Yes,1,No,,2,50,50,5,115,115,3,85,85,8,210,210,1,25,25,0,0,0,1,25,25,1,18,18,1,25,25,1,15,15,1,20,20,0,11,11,0,2,7,1,0,0,0,0,0,0,1,0
TGA,Tameside General Hospital,Tameside And Glossop Integrated Care NHS Foundation Trust,England,325,50,10,16,2,31,21,Yes,2,No,,3,6,30,2,4,20,4,8,40,9,18,90,0,0,0,0,0,0,2,4,20,0,0,0,3,6,30,0,0,0,0,1,3,1,2,10,0,0,1,0,0,0,0,0,0,0,0,0
TOR,Torbay Hospital,Torbay and South Devon NHS Foundation Trust,England,175,20,1-7,9,1,23,19,Yes,2,No,,4,20,100,6,30,150,8,40,200,15,75,375,0,0,0,0,0,0,0,0,0,1,5,25,0,0,0,1,5,25,0,0,0,1,5,25,0,0,0,0,0,0,0,0,0,0,0,0
TUN,Tunbridge Wells Hospital,Maidstone and Tunbridge Wells NHS Trust,England,545,40,15,24,2,28,23,No,,No,,4,10,27,2,5,13,7,18,47,16,40,107,0,0,0,0,0,0,0,0,0,2,5,13,0,0,0,2,5,13,0,0,0,0,0,0,0,1,0,0,0,0,0,0,0,0,0,0
UCL,University College Hospital,University College London Hospitals NHS Foundation Trust,England,-,-,-,-,-,-,31,Yes,7,No,,0,,,4,,,2,,,9,,,0,,,0,,,1,,,1,,,2,,,1,,,7,,,1,,,0,0,1,0,0,0,0,0,0,0,0,0
UHC,University Hospital Coventry,University Hospitals Coventry and Warwickshire NHS Trust,England,580,50,1-7,10,1,7,60,Yes,8,No,,5,10,125,8,16,200,12,24,300,14,28,350,2,4,50,0,0,0,0,0,0,1,2,30,0,0,0,2,4,50,0,0,0,0,0,0,0,0,0,0,0,0,0,0,0,0,1,0
VIK,Victoria Hospital (Kirkcaldy),NHS Fife,Scotland,-,-,-,-,-,-,26,Yes,3,No,-,2,-,-,8,-,-,8,-,-,7,-,-,1,-,-,1,-,-,0,-,-,1,-,-,0,-,-,0,-,-,0,-,-,0.5,-,-,0,7,8,0,0,0,0,0,0,0.5,0.5,0
WAR,Warwick Hospital,South Warwickshire NHS Foundation Trust,England,-,-,-,-,-,-,18,No,-,No,-,1,-,-,8,-,-,3,-,-,9,-,-,0,-,-,0,-,-,6,-,-,0,-,-,0,-,-,0,-,-,0,-,-,2,-,-,-,-,-,-,-,-,-,-,-,-,-,-
WAT,Watford General Hospital,West Hertfordshire Hospitals NHS Trust,England,-,-,-,-,-,-,22,Yes,2,No,-,2,-,-,5,-,-,1,-,-,2,-,-,14,-,-,-,-,-,1,-,-,0,-,-,0,-,-,2,-,-,0,-,-,2,-,-,-,-,-,-,-,-,-,0,0,-,0,-
WCI,West Cumberland Infirmary,North Cumbria Integrated Care NHS Foundation Trust,England,35,10,1-7,3,1,114,14,No,,No,,2,20,50,3,30,75,0,0,0,5,52,130,0,0,0,0,0,0,3,30,75,0,0,0,3,30,75,0,0,0,0,0,0,1,10,25,0,0,0,0,0,0,1,0,0,0,0,0
WDG,Warrington District General Hospital,Warrington and Halton Hospitals NHS Foundation Trust,England,585,65,15,24,3,26,24,Yes,1,No,,0,0,0,8,12,52,6,9,40,9,14,60,0,0,0,0,0,0,2,3,13,1,2,9,1,2,7,0,0,0,0,0,0,1,2,7,0,1,0,0,0,0,0,0,0,0,1,0
WDH,Dorset County Hospital,Dorset County Hospital NHS Foundation Trust,England,75,10,1-7,4,1,53,17,Yes,5,No,,3,30,75,4,40,100,4,40,100,9,90,225,0,0,0,0,0,0,1,10,25,0,0,0,1,10,25,0,0,0,0,0,0,1,10,25,0,0,0,0,0,0,0,1,0,0,0,0
WES,Chelsea & Westminster Hospital,Chelsea And Westminster Hospital NHS Foundation Trust,England,200,25,1-7,4,1,20,48,Yes,8,No,,2,8,50,13,52,325,7,30,185,17,68,425,0,0,0,0,0,0,0,0,0,0,0,0,0,0,0,0,0,0,1,4,25,2,8,50,0,0,0,0,0,0,0,0,0,0,0,0
WEX,Wexham Park Hospital,Frimley Health NHS Foundation Trust,England,280,40,10,12,2,36,23,Yes,5,No,,7,17,68,7,18,70,11,29,114,12,30,120,0,0,0,1,2,6,1,3,10,2,5,18,0,0,0,0,0,0,1,3,10,1,3,10,0,0,0,0,0,0,0,0,0,0,0,0
WHC,Whipps Cross Hospital,Barts Health NHS Trust,England,-,-,-,-,-,-,26,No,-,No,-,2,-,-,12,-,-,8,-,-,10,-,-,2,-,-,1,-,-,2,-,-,0,-,-,0,-,-,0,-,-,0,-,-,1,-,-,0,0,0,0,0,0,0,0,0,0,0,0
WHH,William Harvey Hospital,East Kent Hospitals University NHS Foundation Trust,England,425,30,0,15,1,0,28,Yes,2,No,,1,3,,9,30,,2,7,,8,27,,1,3,,0,0,,6,20,,1,3,,0,0,,0,0,,0,0,,0,0,,0,0,0,0,0,0,0,0,0,0,0,0
WHI,Whiston Hospital,St Helens And Knowsley Teaching Hospitals NHS Trust,England,445,65,15,10,2,34,43,Yes,2,No,,2,3,13,8,12,53,6,9,40,10,15,67,2,3,13,1,2,7,4,5,23,1,2,7,2,3,13,0,0,0,0,0,0,0,0,0,0,0,3,0,0,0,0,0,0,0,0,0
WHT,Whittington Hospital,Whittington Health NHS Trust,England,90,15,1-7,5,1,44,19,Yes,2,No,,1,7,25,9,60,225,20,133,500,10,67,250,1,7,25,0,0,0,0,0,0,2,13,50,0,0,0,0,0,0,2,13,50,1,7,25,0,0,0,0,0,0,0,0,1,0,0,0
WIR,Arrowe Park Hospital,Wirral University Teaching Hospital NHS Foundation Trust,England,420,55,15,22,3,36,19,Yes,2,No,,3,6,20,7,13,47,8,15,53,8,15,53,2,4,13,0,0,0,0,0,0,2,3,10,4,7,27,1,2,7,1,2,7,1,2,7,0,0,0,0,0,0,0,1,0,0,0,0
WMH,Manor Hospital,Walsall Healthcare NHS Trust,England,220,40,10,9,2,46,26,Yes,1,No,,3,8,30,7,17,68,4,10,40,13,33,133,0,0,0,0,0,0,4,10,40,1,2,6,3,8,30,0,0,0,0,0,0,0,0,0,0,1,0,2,0,0,2,0,3,0,0,0
WMU,West Middlesex University Hospital,Chelsea And Westminster Hospital NHS Foundation Trust,England,-,-,-,-,-,-,30,No,-,No,-,1,-,-,12,-,-,14,-,-,12,-,-,1,-,-,0,-,-,0,-,-,0,-,-,0,-,-,0.2,-,-,1,-,-,1,-,-,-,-,-,-,-,-,-,-,-,-,-,-
WRC,Worcestershire Royal Hospital,Worcestershire Acute Hospitals NHS Trust,England,140,15,0,4,0,0,35,No,,No,,6,40,,10,67,,8,53,,12,80,,0,0,,0,0,,0,0,,1,5,,0,0,,1,7,,0,0,,1,7,,0,0,0,0,0,0,0,1,0,0,0,0
WRG,Worthing Hospital,Western Sussex Hospitals NHS Foundation Trust,England,175,20,1-7,9,1,23,20,Yes,1,No,,1,5,25,8,40,198,3,15,75,10,50,250,1,5,25,0,0,0,3,15,75,1,4,18,0,0,0,1,3,13,1,4,20,0,2,11,0,1,4,2,0,0,0,0,0,0,1,0
WSH,West Suffolk Hospital,West Suffolk NHS Foundation Trust,England,200,25,10,20,3,50,10,Yes,2,No,,2,8,20,4,18,44,6,23,58,10,41,104,0,0,0,2,8,20,0,0,0,1,2,6,0,0,0,1,2,6,2,6,16,0,1,2,0,1,0,0,0,0,0,0,0,0,0,0
WYB,Withybush General Hospital,Hywel Dda University LHB,Wales,26,3,0,-,-,0,0,No,,No,,0,0,,0,0,,2,67,,5,167,,0,0,,0,0,,0,0,,0,0,,0,0,,0,0,,0,0,,0,0,,0,0,2,3,0,0,0,0,0,0,0,0
WYT,Wythenshawe Hospital,Manchester University NHS Foundation Trust,England,390,65,10,12,2,26,34,Yes,1,No,,2,3,20,7,11,70,9,14,90,10,15,100,0,0,0,0,0,0,1,2,10,0,1,4,0,0,0,1,2,10,0,0,0,1,2,10,0,0,1,0,0,0,0,0,0,0,0,0
YDH,York District Hospital,York Teaching Hospital NHS Foundation Trust,England,1510,1160,75,69,53,50,22,Yes,2,No,,4,0,5,4,0,5,8,1,10,10,1,13,0,0,0,0,0,0,1,0,2,3,0,4,0,0,0,0,0,0,1,0,1,1,0,1,0,0,0,0,0,0,0,0,0,0,0,0
YEO,Yeovil District Hospital,Yeovil District Hospital NHS Foundation Trust,England,180,15,1-7,8,1,22,24,No,,No,,3,20,75,3,20,75,7,47,178,8,51,190,0,0,0,1,7,25,0,0,0,0,0,0,0,0,0,0,0,0,0,3,10,0,1,3,0,0,0,0,0,0,0,0,0,0,0,0
